{
  "$schema": "../../schema/storage/storage.json",
  "schema_version": 1,
  "name": "Comprehensive persistent storage corpus",
  "description": "Stable synthetic targets exercising every document section, persistent storage area, mutation, encoding, runtime input mode, and representative JSON edge case.",
  "local": [
    {
      "id": "aaaaaaaaaaaaaaaaaaaaaaaaaaaaaaaa",
      "values": {
        "settings": {
          "schemeVersion": 2,
          "enabled": true,
          "fetchNews": false,
          "theme": {
            "mode": 1,
            "brightness": 100,
            "contrast": 100,
            "grayscale": 0,
            "sepia": 0,
            "useFont": false,
            "fontFamily": "Open Sans",
            "textStroke": 0,
            "engine": "dynamicTheme",
            "stylesheet": "",
            "darkSchemeBackgroundColor": "#181a1b",
            "darkSchemeTextColor": "#e8e6e3",
            "lightSchemeBackgroundColor": "#dcdad7",
            "lightSchemeTextColor": "#181a1b",
            "scrollbarColor": "",
            "selectionColor": "auto",
            "styleSystemControls": false,
            "lightColorScheme": "Default",
            "darkColorScheme": "Default",
            "immediateModify": false
          },
          "presets": [
            {
              "id": "solarized",
              "name": "Solarized",
              "urls": ["example.test", "*.example.test"],
              "theme": {
                "mode": 1,
                "brightness": 95,
                "contrast": 90,
                "grayscale": 5,
                "sepia": 10,
                "useFont": true,
                "fontFamily": "Atkinson Hyperlegible",
                "textStroke": 0.25,
                "engine": "dynamicTheme",
                "stylesheet": "",
                "darkSchemeBackgroundColor": "#002b36",
                "darkSchemeTextColor": "#839496",
                "lightSchemeBackgroundColor": "#fdf6e3",
                "lightSchemeTextColor": "#657b83",
                "scrollbarColor": "auto",
                "selectionColor": "#073642",
                "styleSystemControls": true,
                "lightColorScheme": "Solarized Light",
                "darkColorScheme": "Solarized Dark",
                "immediateModify": true
              }
            }
          ],
          "customThemes": [
            {
              "url": ["docs.example.test"],
              "theme": {
                "mode": 1,
                "brightness": 100,
                "contrast": 100,
                "grayscale": 0,
                "sepia": 0,
                "useFont": false,
                "fontFamily": "Open Sans",
                "textStroke": 0,
                "engine": "cssFilter",
                "stylesheet": "html { background: #181a1b !important; }\n",
                "darkSchemeBackgroundColor": "#181a1b",
                "darkSchemeTextColor": "#e8e6e3",
                "lightSchemeBackgroundColor": "#dcdad7",
                "lightSchemeTextColor": "#181a1b",
                "scrollbarColor": "",
                "selectionColor": "auto",
                "styleSystemControls": false,
                "lightColorScheme": "Default",
                "darkColorScheme": "Default",
                "immediateModify": false
              },
              "builtIn": false
            }
          ],
          "enabledByDefault": true,
          "enabledFor": [],
          "disabledFor": ["mail.example.test"],
          "changeBrowserTheme": false,
          "syncSettings": true,
          "syncSitesFixes": false,
          "automation": {
            "enabled": true,
            "mode": "system",
            "behavior": "Scheme"
          },
          "time": {
            "activation": "18:00",
            "deactivation": "09:00"
          },
          "location": {
            "latitude": null,
            "longitude": null
          },
          "previewNewDesign": true,
          "previewNewestDesign": false,
          "enableForPDF": true,
          "enableForProtectedPages": false,
          "enableContextMenus": true,
          "detectDarkTheme": true,
          "metadata": {
            "locale": "bg-BG",
            "note": "Здравей 🌍 こんにちは",
            "literal.dot": {
              "literal~tilde": "seed"
            }
          }
        }
      }
    },
    {
      "id": "bbbbbbbbbbbbbbbbbbbbbbbbbbbbbbbb",
      "values": {
        "json-types": {
          "empty-string": "",
          "string": "line 1\nline 2\t\"quoted\"\\slash",
          "true": true,
          "false": false,
          "null": null,
          "zero": 0,
          "negative-zero": -0,
          "negative": -42,
          "fraction": 1.25,
          "exponent": 6.022e23,
          "max-safe-integer": 9007199254740991,
          "above-safe-integer": 9007199254740993,
          "empty-array": [],
          "empty-object": {},
          "mixed-array": [
            null,
            false,
            0,
            "",
            [],
            {},
            {
              "deep": [
                {
                  "value": "leaf"
                }
              ]
            }
          ]
        },
        "append-list": [
          "base",
          null,
          {
            "id": 1,
            "nested": [true, false]
          }
        ],
        "remove-me": {
          "stale": true
        }
      }
    },
    {
      "id": "cccccccccccccccccccccccccccccccc",
      "values": {
        "plain-neighbor": {
          "mustRemainPlainJSON": true
        }
      }
    },
    {
      "id": "dddddddddddddddddddddddddddddddd",
      "values": {
        "local-clear-one": true,
        "local-clear-two": {
          "nested": "stale"
        }
      }
    },
    {
      "id": "eeeeeeeeeeeeeeeeeeeeeeeeeeeeeeee",
      "values": {
        "document": {
          "object": {
            "keep": "original",
            "replace": "old",
            "remove": "obsolete",
            "deep": {
              "left": 1
            }
          },
          "array": [
            "alpha",
            {
              "id": 1
            }
          ]
        },
        "ordered": {
          "stage": 0
        }
      }
    },
    {
      "id": "ffffffffffffffffffffffffffffffff",
      "values": {
        "input-document": {
          "credentials": {
            "token": "seed"
          },
          "preferences": {
            "existing": true,
            "nested": {
              "left": 1
            }
          },
          "history": ["seed"]
        }
      }
    },
    {
      "id": "gggggggggggggggggggggggggggggggg",
      "values": {
        "root-array": [
          "first",
          {
            "id": 1
          }
        ]
      }
    },
    {
      "id": "hhhhhhhhhhhhhhhhhhhhhhhhhhhhhhhh",
      "values": {
        "key.with.dots~and-tildes": {
          "punctuation": "!@#$%^&*()[]{}:;,/?",
          "unicode-key-ключ-鍵": "value",
          "html-sensitive": "<script>alert(\"x\")</script>&",
          "line-separators": "before between after",
          "control-escapes": "\b\f\n\r\t\u0000"
        }
      }
    }
  ],
  "sync": [
    {
      "id": "aaaaaaaaaaaaaaaaaaaaaaaaaaaaaaaa",
      "values": {
        "syncSettings": true,
        "enabledFor": ["work.example.test"],
        "sync-metadata": {
          "revision": 1,
          "device": "desktop"
        }
      }
    },
    {
      "id": "bbbbbbbbbbbbbbbbbbbbbbbbbbbbbbbb",
      "values": {
        "sync-list": [
          "desktop",
          {
            "kind": "mobile",
            "enabled": false
          }
        ],
        "sync-empty-array": [],
        "sync-empty-object": {}
      }
    },
    {
      "id": "dddddddddddddddddddddddddddddddd",
      "values": {
        "sync-clear-one": true,
        "sync-clear-two": ["stale"]
      }
    },
    {
      "id": "ffffffffffffffffffffffffffffffff",
      "values": {
        "input-sync-document": {
          "flags": {
            "existing": true
          }
        }
      }
    }
  ],
  "local_append": [
    {
      "id": "bbbbbbbbbbbbbbbbbbbbbbbbbbbbbbbb",
      "values": {
        "append-list": [
          "base",
          "bulk-added",
          null,
          {
            "id": 1,
            "nested": [true, false]
          },
          {
            "id": 2
          }
        ]
      }
    }
  ],
  "sync_append": [
    {
      "id": "bbbbbbbbbbbbbbbbbbbbbbbbbbbbbbbb",
      "values": {
        "sync-list": [
          "desktop",
          "sync-bulk-added",
          {
            "kind": "mobile",
            "enabled": false
          }
        ]
      }
    }
  ],
  "operations": [
    {
      "id": "aaaaaaaaaaaaaaaaaaaaaaaaaaaaaaaa",
      "area": "local",
      "key": "settings",
      "operation": "merge",
      "value": {
        "theme": {
          "contrast": 90,
          "sepia": 10
        },
        "automation": {
          "enabled": false
        },
        "metadata": {
          "revision": 2
        }
      }
    },
    {
      "id": "aaaaaaaaaaaaaaaaaaaaaaaaaaaaaaaa",
      "area": "local",
      "key": "settings",
      "path": "theme",
      "operation": "merge",
      "value": {
        "brightness": 95,
        "selectionColor": "#0050a4"
      }
    },
    {
      "id": "aaaaaaaaaaaaaaaaaaaaaaaaaaaaaaaa",
      "area": "local",
      "key": "settings",
      "path": "metadata.literal~1dot.literal~0tilde",
      "operation": "set",
      "value": "escaped-path-updated"
    },
    {
      "id": "aaaaaaaaaaaaaaaaaaaaaaaaaaaaaaaa",
      "area": "local",
      "key": "settings",
      "path": "disabledFor",
      "operation": "append",
      "value": [
        "mail.example.test",
        "calendar.example.test",
        {
          "pattern": "*.internal.test",
          "temporary": true
        }
      ]
    },
    {
      "id": "aaaaaaaaaaaaaaaaaaaaaaaaaaaaaaaa",
      "area": "local",
      "key": "settings",